E70_Thing	class	Thing	Thing	This general class comprises discrete, identifiable, instances of E77 Persistent Item that are documented as single units, that either consist of matter or depend on being carried by matter and are characterized by relative stability.\nThey may be intellectual products or physical things. They may for instance have a solid physical form, an electronic encoding, or they may be a logical concept or structure.	E77_Persistent_Item	0
E71_Man-Made_Thing	class	ManMadeThing	Man-Made Thing	This class comprises discrete, identifiable man-made items that are documented as single units. \nThese items are either intellectual products or man-made physical things, and are characterized by relative stability. They may for instance have a solid physical form, an electronic encoding, or they may be logical concepts or structures.	E70_Thing	0
E72_Legal_Object	class	LegalObject	Legal Object	This class comprises those material or immaterial items to which instances of E30 Right, such as the right of ownership or use, can be applied. \nThis is true for all E18 Physical Thing. In the case of instances of E28 Conceptual Object, however, the identity of the E28 Conceptual Object or the method of its use may be too ambiguous to reliably establish instances of E30 Right, as in the case of taxa and inspirations. Ownership of corporations is currently regarded as out of scope of the CRM.	E70_Thing	0
E73_Information_Object	class	InformationObject	Information Object	This class comprises identifiable immaterial items, such as a poems, jokes, data sets, images, texts, multimedia objects, procedural prescriptions, computer program code, algorithm or mathematical formulae, that have an objectively recognizable structure and are documented as single units. The encoding structure known as a "named graph" also falls under this class, so that each "named graph" is an instance of an E73 Information Object. \nAn E73 Information Object does not depend on a specific physical carrier, which can include human memory, and it can exist on one or more carriers simultaneously. \nInstances of E73 Information Object of a linguistic nature should be declared as instances of the E33 Linguistic Object subclass. Instances of E73 Information Object of a documentary nature should be declared as instances of the E31 Document subclass. Conceptual items such as types and classes are not instances of E73 Information Object, nor are ideas without a reproducible expression.	E89_Propositional_Object|E90_Symbolic_Object	1
E74_Group	class	Group	Group	This class comprises any gatherings or organizations of E39 Actors that act collectively or in a similar way due to any form of unifying relationship. In the wider sense this class also comprises official positions which used to be regarded in certain contexts as one actor, independent of the current holder of the office, such as the president of a country. In such cases, it may happen that the Group never had more than one member. A joint pseudonym (i.e., a name that seems indicative of an individual but that is actually used as a persona by two or more people) is a particular case of E74 Group.\nA gathering of people becomes an E74 Group when it exhibits organizational characteristics usually typified by a set of ideas or beliefs held in common, or actions performed together. These might be communication, creating some common artifact, a common purpose such as study, worship, business, sports, etc. Nationality can be modeled as membership in an E74 Group (cf. HumanML markup). Married couples and other concepts of family are regarded as particular examples of E74 Group.	E39_Actor	1
E75_Conceptual_Object_Appellation	class	ConceptualObjectAppellation	Conceptual Object Appellation	This class comprises appellations that are by their form or syntax specific to identifying instances of E28 Conceptual Object, such as intellectual products, standardized patterns etc.	E41_Appellation	0
E77_Persistent_Item	class	PersistentItem	Persistent Item	This class comprises items that have a persistent identity, sometimes known as “endurants” in philosophy. \nThey can be repeatedly recognized within the duration of their existence by identity criteria rather than by continuity or observation. Persistent Items can be either physical entities, such as people, animals or things, or conceptual entities such as ideas, concepts, products of the imagination or common names.\nThe criteria that determine the identity of an item are often difficult to establish -; the decision depends largely on the judgement of the observer. For example, a building is regarded as no longer existing if it is dismantled and the materials reused in a different configuration. On the other hand, human beings go through radical and profound changes during their life-span, affecting both material composition and form, yet preserve their identity by other criteria. Similarly, inanimate objects may be subject to exchange of parts and matter. The class E77 Persistent Item does not take any position about the nature of the applicable identity criteria and if actual knowledge about identity of an instance of this class exists. There may be cases, where the identity of an E77 Persistent Item is not decidable by a certain state of knowledge.\nThe main classes of objects that fall outside the scope the E77 Persistent Item class are temporal objects such as periods, events and acts, and descriptive properties.	E1_CRM_Entity	0
E78_Collection	class	Collection	Collection	This class comprises aggregations of instances of E18 Physical Thing that are assembled and maintained ("curated" and "preserved", in museological terminology) by one or more instances of E39 Actor over time for a specific purpose and audience, and according to a particular collection development plan.  \nItems may be added or removed from an E78 Collection in pursuit of this plan. This class should not be confused with the E39 Actor maintaining the E78 Collection often referred to with the name of the E78 Collection (e.g. “The Wallace Collection decided…”).\nCollective objects in the general sense, like a tomb full of gifts, a folder with stamps or a set of chessmen, should be documented as instances of E19 Physical Object, and not as instances of E78 Collection. This is because they form wholes either because they are physically bound together or because they are kept together for their functionality.	E24_Physical_Man-Made_Thing	0
E79_Part_Addition	class	PartAddition	Part Addition	This class comprises activities that result in an instance of E24 Physical Man-Made Thing being increased, enlarged or augmented by the addition of a part. \nTypical scenarios include the attachment of an accessory, the integration of a component, the addition of an element to an aggregate object, or the accessioning of an object into a curated E78 Collection. Objects to which parts are added are, by definition, man-made, since the addition of a part implies a human activity. Following the addition of parts, the resulting man-made assemblages are treated objectively as single identifiable wholes, made up of constituent or component parts bound together either physically (for example the engine becoming a part of the car), or by sharing a common purpose (such as the 32 chess pieces that make up a chess set). This class of activities forms a basis for reasoning about the history and continuity of identity of objects that are integrated into other objects over time, such as precious gemstones being repeatedly incorporated into different items of jewellery, or cultural artifacts being added to different museum instances of E78 Collection over their lifespan.	E11_Modification	2
E80_Part_Removal	class	PartRemoval	Part Removal	This class comprises the activities that result in an instance of E18 Physical Thing being decreased by the removal of a part.\nTypical scenarios include the detachment of an accessory, the removal of a component or part of a composite object, or the deaccessioning of an object from a curated E78 Collection. If the E80 Part Removal results in the total decomposition of the original object into pieces, such that the whole ceases to exist, the activity should instead be modelled as an E81 Transformation, i.e. a simultaneous destruction and production. In cases where the part removed has no discernible identity prior to its removal but does have an identity subsequent to its removal, the activity should be regarded as both E80 Part Removal and E12 Production. This class of activities forms a basis for reasoning about the history, and continuity of identity over time, of objects that are removed from other objects, such as precious gemstones being extracted from different items of jewelry, or cultural artifacts being deaccessioned from different museum collections over their lifespan.	E11_Modification	2
E81_Transformation	class	Transformation	Transformation	This class comprises the events that result in the simultaneous destruction of one or more than one E77 Persistent Item and the creation of one or more than one E77 Persistent Item that preserves recognizable substance from the first one(s) but has fundamentally different nature and identity. \nAlthough the old and the new instances of E77 Persistent Item are treated as discrete entities having separate, unique identities, they are causally connected through the E81 Transformation; the destruction of the old E77 Persistent Item(s) directly causes the creation of the new one(s) using or preserving some relevant substance. Instances of E81 Transformation are therefore distinct from re-classifications (documented using E17 Type Assignment) or modifications (documented using E11 Modification) of objects that do not fundamentally change their nature or identity. Characteristic cases are reconstructions and repurposing of historical buildings or ruins, fires leaving buildings in ruins, taxidermy of specimen in natural history and the reorganization of a corporate body into a new one.	E63_Beginning_of_Existence|E64_End_of_Existence	1
E82_Actor_Appellation	class	ActorAppellation	Actor Appellation	This class comprises any sort of name, number, code or symbol characteristically used to identify an E39 Actor. \nAn E39 Actor will typically have more than one E82 Actor Appellation, and instances of E82 Actor Appellation in turn may have alternative representations. The distinction between corporate and personal names, which is particularly important in library applications, should be made by explicitly linking the E82 Actor Appellation to an instance of either E21 Person or E74 Group/E40 Legal Body. If this is not possible, the distinction can be made through the use of the P2 has type mechanism.	E41_Appellation	0
E83_Type_Creation	class	TypeCreation	Type Creation	This class comprises activities formally defining new types of items. \nIt is typically a rigorous scholarly or scientific process that ensures a type is exhaustively described and appropriately named. In some cases, particularly in archaeology and the life sciences, E83 Type Creation requires the identification of an exemplary specimen and the publication of the type definition in an appropriate scholarly forum. The activity of E83 Type Creation is central to research in the life sciences, where a type would be referred to as a “taxon,” the type description as a “protologue,” and the exemplary specimens as “orgininal element” or “holotype”.	E65_Creation	0
E84_Information_Carrier	class	InformationCarrier	Information Carrier	This class comprises all instances of E22 Man-Made Object that are explicitly designed to act as persistent physical carriers for instances of E73 Information Object.\nAn E84 Information Carrier may or may not contain information, e.g., a diskette. Note that any E18 Physical Thing may carry information, such as an E34 Inscription. However, unless it was specifically designed for this purpose, it is not an Information Carrier. Therefore the property P128 carries (is carried by) applies to E18 Physical Thing in general.	E22_Man-Made_Object	0
E85_Joining	class	Joining	Joining	This class comprises the activities that result in an instance of E39 Actor becoming a member of an instance of E74 Group. This class does not imply initiative by either party. It may be the initiative of a third party.\nTypical scenarios include becoming a member of a social organisation, becoming employee of a company, marriage, the adoption of a child by a family and the inauguration of somebody into an official position.	E7_Activity	1
E86_Leaving	class	Leaving	Leaving	This class comprises the activities that result in an instance of E39 Actor to be disassociated from an instance of E74 Group. This class does not imply initiative by either party. It may be the initiative of a third party. \nTypical scenarios include the termination of membership in a social organisation, ending the employment at a company, divorce, and the end of tenure of somebody in an official position.	E7_Activity	1
E87_Curation_Activity	class	CurationActivity	Curation Activity	This class comprises the activities that result in the continuity of management and the preservation and evolution of instances of E78 Collection, following an implicit or explicit curation plan. \nIt specializes the notion of activity into the curation of a collection and allows the history of curation to be recorded.\nItems are accumulated and organized following criteria like subject, chronological period, material type, style of art etc. and can be added or removed from an E78 Collection for a specific purpose and/or audience. The initial aggregation of items of a collection is regarded as an instance of E12 Production Event while the activity of evolving, preserving and promoting a collection is regarded as an instance of E87 Curation Activity.	E7_Activity	0
E89_Propositional_Object	class	PropositionalObject	Propositional Object	This class comprises immaterial items, including but not limited to stories, plots, procedural prescriptions, algorithms, laws of physics or images that are, or represent in some sense, sets of propositions about real or imaginary things and that are documented as single units or serve as topics of discourse. \n \nThis class also comprises items that are “about” something in the sense of a subject. In the wider sense, this class includes expressions of psychological value such as non-figural art and musical themes. However, conceptual items such as types and classes are not instances of E89 Propositional Object. This should not be confused with the definition of a type, which is indeed an instance of E89 Propositional Object.	E28_Conceptual_Object	1
E90_Symbolic_Object	class	SymbolicObject	Symbolic Object	This class comprises identifiable symbols and any aggregation of symbols, such as characters, identifiers, traffic signs, emblems, texts, data sets, images, musical scores, multimedia objects, computer program code or mathematical formulae that have an objectively recognizable structure and that are documented as single units.\n It includes sets of signs of any nature, which may serve to designate something, or to communicate some propositional content.\n An instance of E90 Symbolic Object does not depend on a specific physical carrier, which can include human memory, and it can exist on one or more carriers simultaneously. An instance of E90 Symbolic Object may or may not have a specific meaning, for example an arbitrary character string.\n In some cases, the content of an instance of E90 Symbolic Object may completely be represented by a serialized content model, such.. as the property P3 has note allows for describing this content model…P3.1 has type: E55 Type to specify the encoding..	E28_Conceptual_Object|E72_Legal_Object	0
E92_Spacetime_Volume	class	SpacetimeVolume	Spacetime Volume	This class comprises 4 dimensional point sets (volumes) in physical spacetime regardless its true geometric form. They may derive their identity from being the extent of a material phenomenon or from being the interpretation of an expression defining an extent in spacetime. \n Intersections of instances of E92 Spacetime Volume, Place and Timespan are also regarded as instances of E92 Spacetime Volume.  An instance of E92 Spacetime Volume is either contiguous or composed of a finite number of contiguous subsets. \n Its boundaries may be fuzzy due to the properties of the phenomena it derives from or due to the limited precision up to which defining expression can be identified with a real extent in spacetime. The duration of existence of an instance of a spacetime volume is trivially its projection on time.	E1_CRM_Entity	0
E93_Presence	class	Presence	Presence	This class comprises instances of E92 Spacetime Volume that result from intersection of instances of E92 Spacetime Volume with an instance of E52 Time-Span.  The identity of an instance of this class is determined by the identities of the  constituing spacetime volume and the time-span. \n \nThis class can be used to define temporal snapshots at a particular time-span, such as the extent of the Roman Empire at 33 B.C., or the extent occupied by a museum object at rest in an exhibit. In particular, it can be used to define the spatial projection of a spacetime volume during a particular time-span,  such as the maximal spatial extent of a flood at some particular hour, or all areas covered by the Poland within the 20th century AD.	E92_Spacetime_Volume	0
P1_is_identified_by	property	identified_by	is identified by	This property describes the naming or identification of any real world item by a name or any other identifier. \nThis property is intended for identifiers in general use, which form part of the world the model intends to describe, and not merely for internal database identifiers which are specific to a technical system, unless these latter also have a more general use outside the technical context. This property includes in particular identification by mathematical expressions such as coordinate systems used for the identification of instances of E53 Place. The property does not reveal anything about when, where and by whom this identifier was used. A more detailed representation can be made using the fully developed (i.e. indirect) path through E15 Identifier Assignment.		E1_CRM_Entity	E41_Appellation	P1i_identifies	10	1	1
P1i_identifies	property	identifies	identifies			E41_Appellation	E1_CRM_Entity	P1_is_identified_by	10000	1	0
P2_has_type	property	classified_as	has type	This property allows sub typing of CRM entities - a form of specialisation – through the use of a terminological hierarchy, or thesaurus. \nThe CRM is intended to focus on the high-level entities and relationships needed to describe data structures. Consequently, it does not specialise entities any further than is required for this immediate purpose. However, entities in the isA hierarchy of the CRM may by specialised into any number of sub entities, which can be defined in the E55 Type hierarchy. E51 Contact Point, for example, may be specialised into “e-mail address”, “telephone number”, “post office box”, “URL” etc. none of which figures explicitly in the CRM hierarchy. Sub typing obviously requires consistency between the meaning of the terms assigned and the more general intent of the CRM entity in question.		E1_CRM_Entity	E55_Type	P2i_is_type_of	3	1	1
P2i_is_type_of	property	type_of	is type of			E55_Type	E1_CRM_Entity	P2_has_type	10000	0	0
P3_has_note	property	note	has note	This property is a container for all informal descriptions about an object that have not been expressed in terms of CRM constructs. \nIn particular it captures the characterisation of the item itself, its internal structures, appearance etc.\nLike property P2 has type (is type of), this property is a consequence of the restricted focus of the CRM. The aim is not to capture, in a structured form, everything that can be said about an item; indeed, the CRM formalism is not regarded as sufficient to express everything that can be said. Good practice requires use of distinct note fields for different aspects of a characterisation. The P3.1 has type property of P3 has note allows differentiation of specific notes, e.g. “construction”, “decoration” etc. \nAn item may have many notes, but a note is attached to a specific item.		E1_CRM_Entity	rdfs:Literal		10000	0	0
P4_has_time-span	property	timespan	has time-span	This property describes the temporal confinement of an instance of an E2 Temporal Entity.\nThe related E52 Time-Span is understood as the real Time-Span during which the phenomena were active, which make up the temporal entity instance. It does not convey any other meaning than a positioning on the “time-line” of chronology. The Time-Span in turn is approximated by a set of dates (E61 Time Primitive). A temporal entity can have in reality only one Time-Span, but there may exist alternative opinions about it, which we would express by assigning multiple Time-Spans. Related temporal entities may share a Time-Span. Time-Spans may have completely unknown dates but other descriptions by which we can infer knowledge.		E2_Temporal_Entity	E52_Time-Span	P4i_is_time-span_of	20	1	0
P4i_is_time-span_of	property	timespan_of	is time-span of			E52_Time-Span	E2_Temporal_Entity	P4_has_time-span	10000	0	0
P5_consists_of	property	subState	consists of	This property describes the decomposition of an E3 Condition State into discrete, subsidiary states. \nIt is assumed that the sub-states into which the condition state is analysed form a logical whole - although the entire story may not be completely known – and that the sub-states are in fact constitutive of the general condition state. For example, a general condition state of “in ruins” may be decomposed into the individual stages of decay		E3_Condition_State	E3_Condition_State	P5i_forms_part_of	10000	0	0
P5i_forms_part_of	property	subState_of	forms part of			E3_Condition_State	E3_Condition_State	P5_consists_of	10000	0	0
P7_took_place_at	property	took_place_at	took place at	This property describes the spatial location of an instance of E4 Period. \n\nThe related E53 Place should be seen as an approximation of the geographical area within which the phenomena that characterise the period in question occurred. P7took place at (witnessed) does not convey any meaning other than spatial positioning (generally on the surface of the earth).  For example, the period "Révolution française" can be said to have taken place in “France”, the “Victorian” period, may be said to have taken place in “Britain” and its colonies, as well as other parts of Europe and north America.\nA period can take place at multiple locations.\nIt is a shortcut of the more fully developed path from E4 Period through P161 has spatial projection, E53 Place, P89 falls within (contains) to E53 Place.		E4_Period	E53_Place	P7i_witnessed	30	1	1
P7i_witnessed	property	location_of	witnessed			E53_Place	E4_Period	P7_took_place_at	10000	0	0
P8_took_place_on_or_within	property	took_place_on_or_within	took place on or within	This property describes the location of an instance of E4 Period with respect to an E19 Physical Object. \nP8 took place on or within (witnessed) is a shortcut of the more fully developed path from E4 Period through P7 took place at, E53 Place, P156 occupies (is occupied by) to E18 Physical Thing.\n\nIt describes a period that can be located with respect to the space defined by an E19 Physical Object such as a ship or a building. The precise geographical location of the object during the period in question may be unknown or unimportant. \nFor example, the French and German armistice of 22 June 1940 was signed in the same railway carriage as the armistice of 11 November 1918.		E4_Period	E18_Physical_Thing	P8i_witnessed	10000	0	0
P8i_witnessed	property	witnessed	witnessed			E18_Physical_Thing	E4_Period	P8_took_place_on_or_within	10000	0	0
P9_consists_of	property	consists_of	consists of	This property associates an instance of E4 Period with another instance of E4 Period that is defined by a subset of the phenomena that define the former. Therefore the spacetime volume of the latter must fall within the spacetime volume of the former.	P10i_contains	E4_Period	E4_Period	P9i_forms_part_of	100	1	1
P9i_forms_part_of	property	forms_part_of	forms part of		P10_falls_within	E4_Period	E4_Period	P9_consists_of	10000	1	1
P10_falls_within	property	falls_within	falls within	This property associates an instance of E92 Spacetime Volume with another instance of E92 Spacetime Volume that falls within the latter. In other words, all points in the former are also points in the latter.		E92_Spacetime_Volume	E92_Spacetime_Volume	P10i_contains	10000	0	0
P10i_contains	property	contains	contains			E92_Spacetime_Volume	E92_Spacetime_Volume	P10_falls_within	10000	0	0
P11_had_participant	property	participant	had participant	This property describes the active or passive participation of instances of E39 Actors in an E5 Event. \nIt connects the life-line of the related E39 Actor with the E53 Place and E50 Date of the event. The property implies that the Actor was involved in the event but does not imply any causal relationship. The subject of a portrait can be said to have participated in the creation of the portrait.	P12_occurred_in_the_presence_of	E5_Event	E39_Actor	P11i_participated_in	10000	0	0
P11i_participated_in	property	participated_in	participated in		P12i_was_present_at	E39_Actor	E5_Event	P11_had_participant	10000	0	0
