E1_CRM_Entity	class	CRMEntity	CRM Entity	This class comprises all things in the universe of discourse of the CIDOC Conceptual Reference Model. \nIt is an abstract concept providing for three general properties:\n1. Identification by name or appellation, and in particular by a preferred identifier\n2. Classification by type, allowing further refinement of the specific subclass an instance belongs to \n3. Attachment of free text for the expression of anything not captured by formal properties\nWith the exception of E59 Primitive Value, all other classes within the CRM are directly or indirectly specialisations of E1 CRM Entity.		0
E2_Temporal_Entity	class	TemporalEntity	Temporal Entity	This class comprises all phenomena, such as the instances of E4 Periods, E5 Events and states, which happen over a limited extent in time. \n In some contexts, these are also called perdurants. This class is disjoint from E77 Persistent Item. This is an abstract class and has no direct instances. E2 Temporal Entity is specialized into E4 Period, which applies to a particular geographic area (defined with a greater or lesser degree of precision), and E3 Condition State, which applies to instances of E18 Physical Thing.	E1_CRM_Entity	0
E3_Condition_State	class	ConditionState	Condition State	This class comprises the states of objects characterised by a certain condition over a time-span. \nAn instance of this class describes the prevailing physical condition of any material object or feature during a specific E52 Time Span. In general, the time-span for which a certain condition can be asserted may be shorter than the real time-span, for which this condition held.\n The nature of that condition can be described using P2 has type. For example, the E3 Condition State “condition of the SS Great Britain between 22 September 1846 and 27 August 1847” can be characterized as E55 Type “wrecked”.	E2_Temporal_Entity	0
E4_Period	class	Period	Period	This class comprises sets of coherent phenomena or cultural manifestations occurring in time and space.\n\nIt is the social or physical coherence of these phenomena that identify an E4 Period and not the associated spatiotemporal extent. This extent is only the "ground" or space in an abstract physical sense that the actual process of growth, spread and retreat has covered. Consequently, different periods can overlap and coexist in time and space, such as when a nomadic culture exists in the same area and time as a sedentary culture. This also means that overlapping land use rights, common among first nations, amounts to overlapping periods.\n\nOften, this class is used to describe prehistoric or historic periods such as the "Neolithic Period", the "Ming Dynasty" or the "McCarthy Era", but also geopolitical units and activities of settlements are regarded as special cases of E4 Period. However, there are no assumptions about the scale of the associated phenomena. In particular all events are seen as synthetic processes consisting of coherent phenomena. Therefore E4 Period is a superclass of E5 Event. For example, a modern clinical E67 Birth can be seen as both an atomic E5 Event and as an E4 Period that consists of multiple activities performed by multiple instances of E39 Actor.\n\nAs the actual extent of an E4 Period in spacetime we regard the trajectories of the participating physical things during their participation in an instance of E4 Period. This includes the open spaces via which these things have interacted and the spaces by which they had the potential to interact during that period or event in the way defined by the type of the respective period or event. Examples include the air in a meeting room transferring the voices of the participants. Since these phenomena are fuzzy, we assume the spatiotemporal extent to be contiguous, except for cases of phenomena spreading out over islands or other separated areas, including geopolitical units distributed over disconnected areas such as islands or colonies.\n\nWhether the trajectories necessary for participants to travel between these areas are regarded as part of the spatiotemporal extent or not has to be decided in each case based on a concrete analysis, taking use of the sea for other purposes than travel, such as fishing, into consideration. One may also argue that the activities to govern disconnected areas imply travelling through spaces connecting them and that these areas hence are spatially connected in a way, but it appears counterintuitive to consider for instance travel routes in international waters as extensions of geopolitical units.\n\nConsequently, an instance of E4 Period may occupy a number of disjoint spacetime volumes, however there must not be a discontinuity in the  timespan covered by these spacetime volumes. This means that an instance of E4 Period must be contiguous in time. If it has ended in all areas, it has ended as a whole. However it may end in one area before another, such as in the Polynesian migration, and it continues as long as it is ongoing in at least  one area.\n\nWe model E4 Period as a subclass of E2 Temporal Entity and of E92 Spacetime volume. The latter is intended as a phenomenal spacetime volume as defined in CRMgeo (Doerr and Hiebel 2013). By virtue of this multiple inheritance we can discuss the physical extent of an E4 Period without representing each instance of it together with an instance of its associated spacetime volume. This model combines two quite different kinds of substance: an instance of E4 Period is a phenomena while a space-time volume is an aggregation of points in spacetime. However, the real spatiotemporal extent of an instance of E4 Period is regarded to be unique to it due to all its details and fuzziness; its identity and existence depends uniquely on the identity of the instance of E4 Period. Therefore this multiple inheritance is unambiguous and effective and furthermore corresponds to the intuitions of natural language.\n\nThere are two different conceptualisations of 'artistic style', defined either by physical features or by historical context. For example, “Impressionism” can be viewed as a period lasting from approximately 1870 to 1905 during which paintings with particular characteristics were produced by a group of artists that included (among others) Monet, Renoir, Pissarro, Sisley and Degas. Alternatively, it can be regarded as a style applicable to all paintings sharing the characteristics of the works produced by the Impressionist painters, regardless of historical context. The first interpretation is an instance of E4 Period, and the second defines morphological object types that fall under E55 Type.\n\nAnother specific case of an E4 Period is the set of activities and phenomena associated with a settlement, such as the populated period of Nineveh.	E2_Temporal_Entity|E92_Spacetime_Volume	2
E5_Event	class	Event	Event	This class comprises changes of states in cultural, social or physical systems, regardless of scale, brought about by a series or group of coherent physical, cultural, technological or legal phenomena. Such changes of state will affect instances of E77 Persistent Item or its subclasses.\nThe distinction between an E5 Event and an E4 Period is partly a question of the scale of observation. Viewed at a coarse level of detail, an E5 Event is an ‘instantaneous’ change of state. At a fine level, the E5 Event can be analysed into its component phenomena within a space and time frame, and as such can be seen as an E4 Period. The reverse is not necessarily the case: not all instances of E4 Period give rise to a noteworthy change of state.	E4_Period	2
E6_Destruction	class	Destruction	Destruction	This class comprises events that destroy one or more instances of E18 Physical Thing such that they lose their identity as the subjects of documentation.  \nSome destruction events are intentional, while others are independent of human activity. Intentional destruction may be documented by classifying the event as both an E6 Destruction and E7 Activity. \nThe decision to document an object as destroyed, transformed or modified is context sensitive: \n1.  If the matter remaining from the destruction is not documented, the event is modelled solely as E6 Destruction. \n2. An event should also be documented using E81 Transformation if it results in the destruction of one or more objects and the simultaneous production of others using parts or material from the original. In this case, the new items have separate identities. Matter is preserved, but identity is not.\n3. When the initial identity of the changed instance of E18 Physical Thing is preserved, the event should be documented as E11 Modification.	E64_End_of_Existence	0
E7_Activity	class	Activity	Activity	This class comprises actions intentionally carried out by instances of E39 Actor that result in changes of state in the cultural, social, or physical systems documented. \nThis notion includes complex, composite and long-lasting actions such as the building of a settlement or a war, as well as simple, short-lived actions such as the opening of a door.	E5_Event	1
E8_Acquisition	class	Acquisition	Acquisition	This class comprises transfers of legal ownership from one or more instances of E39 Actor to one or more other instances of E39 Actor. \nThe class also applies to the establishment or loss of ownership of instances of E18 Physical Thing. It does not, however, imply changes of any other kinds of right. The recording of the donor and/or recipient is optional. It is possible that in an instance of E8 Acquisition there is either no donor or no recipient. Depending on the circumstances, it may describe:\n1. the beginning of ownership\n2. the end of ownership\n3. the transfer of ownership\n4. the acquisition from an unknown source \n5. the loss of title due to destruction of the item\nIt may also describe events where a collector appropriates legal title, for example by annexation or field collection. The interpretation of the museum notion of "accession" differs between institutions. The CRM therefore models legal ownership (E8 Acquisition) and physical custody (E10 Transfer of Custody) separately. Institutions will then model their specific notions of accession and deaccession as combinations of these.	E7_Activity	1
E9_Move	class	Move	Move	This class comprises changes of the physical location of the instances of E19 Physical Object. \nNote, that the class E9 Move inherits the property P7 took place at (witnessed): E53 Place. This property should be used to describe the trajectory or a larger area within which a move takes place, whereas the properties P26 moved to (was destination of), P27 moved from (was origin of) describe the start and end points only. Moves may also be documented to consist of other moves (via P9 consists of (forms part of)), in order to describe intermediate stages on a trajectory. In that case, start and end points of the partial moves should match appropriately between each other and with the overall event.	E7_Activity	2
E10_Transfer_of_Custody	class	TransferOfCustody	Transfer of Custody	This class comprises transfers of physical custody of objects between instances of E39 Actor. \nThe recording of the donor and/or recipient is optional. It is possible that in an instance of E10 Transfer of Custody there is either no donor or no recipient. Depending on the circumstances it may describe:\n1. the beginning of custody \n2. the end of custody \n3. the transfer of custody \n4. the receipt of custody from an unknown source\n5. the declared loss of an object\nThe distinction between the legal responsibility for custody and the actual physical possession of the object should be expressed using the property P2 has type (is type of). A specific case of transfer of custody is theft.\nThe interpretation of the museum notion of "accession" differs between institutions. The CRM therefore models legal ownership and physical custody separately. Institutions will then model their specific notions of accession and deaccession as combinations of these.	E7_Activity	1
E11_Modification	class	Modification	Modification	This class comprises all instances of E7 Activity that create, alter or change E24 Physical Man-Made Thing. \nThis class includes the production of an item from raw materials, and other so far undocumented objects, and the preventive treatment or restoration of an object for conservation. \nSince the distinction between modification and production is not always clear, modification is regarded as the more generally applicable concept. This implies that some items may be consumed or destroyed in a Modification, and that others may be produced as a result of it. An event should also be documented using E81 Transformation if it results in the destruction of one or more objects and the simultaneous production of others using parts or material from the originals. In this case, the new items have separate identities. \nIf the instance of the E29 Design or Procedure utilized for the modification prescribes the use of specific materials, they should be documented using property P68 foresees use of (use foreseen by): E57 Material of E29 Design or Procedure, rather than via P126 employed (was employed in): E57 Material.	E7_Activity	2
E12_Production	class	Production	Production	This class comprises activities that are designed to, and succeed in, creating one or more new items. \nIt specializes the notion of modification into production. The decision as to whether or not an object is regarded as new is context sensitive. Normally, items are considered “new” if there is no obvious overall similarity between them and the consumed items and material used in their production. In other cases, an item is considered “new” because it becomes relevant to documentation by a modification. For example, the scribbling of a name on a potsherd may make it a voting token. The original potsherd may not be worth documenting, in contrast to the inscribed one. \nThis entity can be collective: the printing of a thousand books, for example, would normally be considered a single event. \nAn event should also be documented using E81 Transformation if it results in the destruction of one or more objects and the simultaneous production of others using parts or material from the originals. In this case, the new items have separate identities and matter is preserved, but identity is not.	E11_Modification|E63_Beginning_of_Existence	1
E13_Attribute_Assignment	class	AttributeAssignment	Attribute Assignment	This class comprises the actions of making assertions about properties of an object or any relation between two items or concepts. \nThis class allows the documentation of how the respective assignment came about, and whose opinion it was. All the attributes or properties assigned in such an action can also be seen as directly attached to the respective item or concept, possibly as a collection of contradictory values. All cases of properties in this model that are also described indirectly through an action are characterised as "short cuts" of this action. This redundant modelling of two alternative views is preferred because many implementations may have good reasons to model either the action or the short cut, and the relation between both alternatives can be captured by simple rules. \nIn particular, the class describes the actions of people making propositions and statements during certain museum procedures, e.g. the person and date when a condition statement was made, an identifier was assigned, the museum object was measured, etc. Which kinds of such assignments and statements need to be documented explicitly in structures of a schema rather than free text, depends on if this information should be accessible by structured queries.	E7_Activity	1
E14_Condition_Assessment	class	ConditionAssessment	Condition Assessment	This class describes the act of assessing the state of preservation of an object during a particular period. \nThe condition assessment may be carried out by inspection, measurement or through historical research. This class is used to document circumstances of the respective assessment that may be relevant to interpret its quality at a later stage, or to continue research on related documents.	E13_Attribute_Assignment	0
E15_Identifier_Assignment	class	IdentifierAssignment	Identifier Assignment	This class comprises activities that result in the allocation of an identifier to an instance of E1 CRM Entity. An E15 Identifier Assignment may include the creation of the identifier from multiple constituents, which themselves may be instances of E41 Appellation. The syntax and kinds of constituents to be used may be declared in a rule constituting an instance of E29 Design or Procedure.\nExamples of such identifiers include Find Numbers, Inventory Numbers, uniform titles in the sense of librarianship and Digital Object Identifiers (DOI). Documenting the act of identifier assignment and deassignment is especially useful when objects change custody or the identification system of an organization is changed. In order to keep track of the identity of things in such cases, it is important to document by whom, when and for what purpose an identifier is assigned to an item.\nThe fact that an identifier is a preferred one for an organisation can be expressed by using the property E1 CRM Entity. P48 has preferred identifier (is preferred identifier of): E42 Identifier. It can better be expressed in a context independent form by assigning a suitable E55 Type, such as “preferred identifier assignment”, to the respective instance of E15 Identifier Assignment via the P2 has type property.	E13_Attribute_Assignment	0
E16_Measurement	class	Measurement	Measurement	This class comprises actions measuring physical properties and other values that can be determined by a systematic procedure. \nExamples include measuring the monetary value of a collection of coins or the running time of a specific video cassette. \nThe E16 Measurement may use simple counting or tools, such as yardsticks or radiation detection devices. The interest is in the method and care applied, so that the reliability of the result may be judged at a later stage, or research continued on the associated documents. The date of the event is important for dimensions, which may change value over time, such as the length of an object subject to shrinkage. Details of methods and devices are best handled as free text, whereas basic techniques such as "carbon 14 dating" should be encoded using P2 has type (is type of:) E55 Type.	E13_Attribute_Assignment	0
E17_Type_Assignment	class	TypeAssignment	Type Assignment	This class comprises the actions of classifying items of whatever kind. Such items include objects, specimens, people, actions and concepts. \nThis class allows for the documentation of the context of classification acts in cases where the value of the classification depends on the personal opinion of the classifier, and the date that the classification was made. This class also encompasses the notion of "determination," i.e. the systematic and molecular identification of a specimen in biology.	E13_Attribute_Assignment	0
E18_Physical_Thing	class	PhysicalThing	Physical Thing	This class comprises all persistent physical items with a relatively stable form, man-made or natural.\n\nDepending on the existence of natural boundaries of such things, the CRM distinguishes the instances of E19 Physical Object from instances of E26 Physical Feature, such as holes, rivers, pieces of land etc. Most instances of E19 Physical Object can be moved (if not too heavy), whereas features are integral to the surrounding matter.\n\nAn instance of E18 Physical Thing occupies not only a particular geometric space, but in the course of its existence it also forms a trajectory through spacetime, which occupies a real, that is phenomenal, volume in spacetime. We include in the occupied space the space filled by the matter of the physical thing and all its inner spaces, such as the interior of a box. Physical things consisting of aggregations of physically unconnected objects, such as a set of chessmen, occupy a number of individually contiguous spacetime volumes equal to the number of unconnected objects that constitute the set.\n\nWe model E18 Physical Thing to be a subclass of E72 Legal Object and of E92 Spacetime volume. The latter is intended as a phenomenal spacetime volume as defined in CRMgeo (Doerr and Hiebel 2013). By virtue of this multiple inheritance we can discuss the physical extent of an E18 Physical Thing without representing each instance of it together with an instance of its associated spacetime volume. This model combines two quite different kinds of substance: an instance of E18 Physical Thing is matter while a spacetime volume is an aggregation of points in spacetime. However, the real spatiotemporal extent of an instance of E18 Physical Thing is regarded to be unique to it, due to all its details and fuzziness; its identity and existence depends uniquely on the identity of the instance of E18 Physical Thing. Therefore this multiple inheritance is unambiguous and effective and furthermore corresponds to the intuitions of natural language.\n\nThe CIDOC CRM is generally not concerned with amounts of matter in fluid or gaseous states.	E72_Legal_Object|E92_Spacetime_Volume	0
E19_Physical_Object	class	PhysicalObject	Physical Object	This class comprises items of a material nature that are units for documentation and have physical boundaries that separate them completely in an objective way from other objects. \nThe class also includes all aggregates of objects made for functional purposes of whatever kind, independent of physical coherence, such as a set of chessmen. Typically, instances of E19 Physical Object can be moved (if not too heavy).\nIn some contexts, such objects, except for aggregates, are also called “bona fide objects” (Smith & Varzi, 2000, pp.401-420), i.e. naturally defined objects. \nThe decision as to what is documented as a complete item, rather than by its parts or components, may be a purely administrative decision or may be a result of the order in which the item was acquired.	E18_Physical_Thing	0
E20_Biological_Object	class	BiologicalObject	Biological Object	This class comprises individual items of a material nature, which live, have lived or are natural products of or from living organisms. \nArtificial objects that incorporate biological elements, such as Victorian butterfly frames, can be documented as both instances of E20 Biological Object and E22 Man-Made Object.	E19_Physical_Object	0
E21_Person	class	Person	Person	This class comprises real persons who live or are assumed to have lived. \nLegendary figures that may have existed, such as Ulysses and King Arthur, fall into this class if the documentation refers to them as historical figures. In cases where doubt exists as to whether several persons are in fact identical, multiple instances can be created and linked to indicate their relationship. The CRM does not propose a specific form to support reasoning about possible identity.	E20_Biological_Object|E39_Actor	1
E22_Man-Made_Object	class	ManMadeObject	Man-Made Object	This class comprises physical objects purposely created by human activity.\nNo assumptions are made as to the extent of modification required to justify regarding an object as man-made. For example, an inscribed piece of rock or a preserved butterfly are both regarded as instances of E22 Man-Made Object.	E19_Physical_Object|E24_Physical_Man-Made_Thing	1
E24_Physical_Man-Made_Thing	class	PhysicalManMadeThing	Physical Man-Made Thing	This class comprises all persistent physical items that are purposely created by human activity.\nThis class comprises man-made objects, such as a swords, and man-made features, such as rock art. No assumptions are made as to the extent of modification required to justify regarding an object as man-made. For example, a “cup and ring” carving on bedrock is regarded as instance of E24 Physical Man-Made Thing.	E18_Physical_Thing|E71_Man-Made_Thing	0
E25_Man-Made_Feature	class	ManMadeFeature	Man-Made Feature	This class comprises physical features that are purposely created by human activity, such as scratches, artificial caves, artificial water channels, etc. \nNo assumptions are made as to the extent of modification required to justify regarding a feature as man-made. For example, rock art or even “cup and ring” carvings on bedrock a regarded as types of E25 Man-Made Feature.	E24_Physical_Man-Made_Thing|E26_Physical_Feature	0
