P50_has_current_keeper	property	current_keeper	has current keeper	This property identifies the E39 Actor or Actors who had custody of an instance of E18 Physical Thing at the time of validity of the record or database containing the statement that uses this property.\n P50 has current keeper (is current keeper of) is a shortcut for the more detailed path from E18 Physical Thing through P30 transferred custody of (custody transferred through), E10 Transfer of Custody, P29 custody received by (received custody through) to E39 Actor.	P49_has_former_or_current_keeper	E18_Physical_Thing	E39_Actor	P50i_is_current_keeper_of	10000	1	0
P50i_is_current_keeper_of	property	current_keeper_of	is current keeper of		P49i_is_former_or_current_keeper_of	E39_Actor	E18_Physical_Thing	P50_has_current_keeper	10000	1	1
P51_has_former_or_current_owner	property	former_or_current_owner	has former or current owner	This property identifies the E39 Actor that is or has been the legal owner (i.e. title holder) of an instance of E18 Physical Thing at some time.\nThe distinction with P52 has current owner (is current owner of) is that P51 has former or current owner (is former or current owner of) does not indicate whether the specified owners are current. P51 has former or current owner (is former or current owner of) is a shortcut for the more detailed path from E18 Physical Thing through P24 transferred title of (changed ownership through), E8 Acquisition, P23 transferred title from (surrendered title through), or P22 transferred title to (acquired title through) to E39 Actor.		E18_Physical_Thing	E39_Actor	P51i_is_former_or_current_owner_of	10000	0	0
P51i_is_former_or_current_owner_of	property	former_or_current_owner_of	is former or current owner of			E39_Actor	E18_Physical_Thing	P51_has_former_or_current_owner	10000	0	0
P52_has_current_owner	property	current_owner	has current owner	This property identifies the E21 Person, E74 Group or E40 Legal Body that was the owner of an instance of E18 Physical Thing at the time of validity of the record or database containing the statement that uses this property.\nP52 has current owner (is current owner of) is a shortcut for the more detailed path from E18 Physical Thing through P24 transferred title of (changed ownership through), E8 Acquisition, P22 transferred title to (acquired title through) to E39 Actor, if and only if this acquisition event is the most recent.	P51_has_former_or_current_owner	E18_Physical_Thing	E39_Actor	P52i_is_current_owner_of	10000	1	0
P52i_is_current_owner_of	property	current_owner_of	is current owner of		P51i_is_former_or_current_owner_of	E39_Actor	E18_Physical_Thing	P52_has_current_owner	10000	1	1
P53_has_former_or_current_location	property	former_or_current_location	has former or current location	This property allows an instance of E53 Place to be associated as the former or current location of an instance of E18 Physical Thing.\nIn the case of E19 Physical Objects, the property does not allow any indication of the Time-Span during which the Physical Object was located at this Place, nor if this is the current location.\nIn the case of immobile objects, the Place would normally correspond to the Place of creation.\nP53 has former or current location (is former or current location of) is a shortcut. A more detailed representation can make use of the fully developed (i.e. indirect) path from E19 Physical Object through P25 moved (moved by), E9 Move, P26 moved to (was destination of) or P27 moved from (was origin of) to E53 Place.		E18_Physical_Thing	E53_Place	P53i_is_former_or_current_location_of	10000	0	0
P53i_is_former_or_current_location_of	property	former_or_current_location_of	is former or current location of			E53_Place	E18_Physical_Thing	P53_has_former_or_current_location	10000	0	0
P54_has_current_permanent_location	property	current_permanent_location	has current permanent location	This property records the foreseen permanent location of an instance of E19 Physical Object at the time of validity of the record or database containing the statement that uses this property.\nP54 has current permanent location (is current permanent location of) is similar to P55 has current location (currently holds). However, it indicates the E53 Place currently reserved for an object, such as the permanent storage location or a permanent exhibit location. The object may be temporarily removed from the permanent location, for example when used in temporary exhibitions or loaned to another institution. The object may never actually be located at its permanent location.		E19_Physical_Object	E53_Place	P54i_is_current_permanent_location_of	10000	0	0
P54i_is_current_permanent_location_of	property	current_permanent_location_of	is current permanent location of			E53_Place	E19_Physical_Object	P54_has_current_permanent_location	10000	0	0
P55_has_current_location	property	current_location	has current location	This property records the location of an E19 Physical Object at the time of validity of the record or database containing the statement that uses this property. \n This property is a specialisation of P53 has former or current location (is former or current location of). It indicates that the E53 Place associated with the E19 Physical Object is the current location of the object. The property does not allow any indication of how long the Object has been at the current location. \nP55 has current location (currently holds) is a shortcut. A more detailed representation can make use of the fully developed (i.e. indirect) path from E19 Physical Object through P25 moved (moved by), E9 Move P26 moved to (was destination of) to E53 Place if and only if this Move is the most recent.	P53_has_former_or_current_location	E19_Physical_Object	E53_Place	P55i_currently_holds	10000	1	0
P55i_currently_holds	property	currently_holds	currently holds		P53i_is_former_or_current_location_of	E53_Place	E19_Physical_Object	P55_has_current_location	10000	1	1
P56_bears_feature	property	bears	bears feature	This property links an instance of E19 Physical Object to an instance of E26 Physical Feature that it bears.\nAn E26 Physical Feature can only exist on one object. One object may bear more than one E26 Physical Feature. An E27 Site should be considered as an E26 Physical Feature on the surface of the Earth.\nAn instance B of E26 Physical Feature being a detail of the structure of another instance A of E26 Physical Feature can be linked to B by use of the property P46 is composed of (forms part of). This implies that the subfeature B is P56i found on the same E19 Physical Object as A.\nP56 bears feature (is found on) is a shortcut. A more detailed representation can make use of the fully developed (i.e. indirect) path from E19 Physical Object through P59 has section (is located on or\nDefinition of the CIDOC Conceptual Reference Model 149 within), E53 Place, P53 has former or current location (is former or current location of) to E26 Physical Feature.	P46_is_composed_of	E19_Physical_Object	E26_Physical_Feature	P56i_is_found_on	10000	1	1
P56i_is_found_on	property	found_on	is found on		P46i_forms_part_of	E26_Physical_Feature	E19_Physical_Object	P56_bears_feature	10000	1	0
P57_has_number_of_parts	property	number_of_parts	has number of parts	This property documents the E60 Number of parts of which an instance of E19 Physical Object is composed.\nThis may be used as a method of checking inventory counts with regard to aggregate or collective objects. What constitutes a part or component depends on the context and requirements of the documentation. Normally, the parts documented in this way would not be considered as worthy of individual attention.\nFor a more complete description, objects may be decomposed into their components and constituents using P46 is composed of (forms parts of) and P45 consists of (is incorporated in). This allows each element to be described individually.		E19_Physical_Object	rdfs:Literal		10000	0	0
P58_has_section_definition	property	section_definition	has section definition	This property links an area (section) named by a E46 Section Definition to the instance of E18 Physical Thing upon which it is found.\nThe CRM handles sections as locations (instances of E53 Place) within or on E18 Physical Thing that are identified by E46 Section Definitions. Sections need not be discrete and separable components or parts of an object.\nThis is part of a more developed path from E18 Physical Thing through P58, E46 Section Definition, P87 is identified by (identifies) that allows a more precise definition of a location found on an object than the shortcut P59 has section (is located on or within).\nA particular instance of a Section Definition only applies to one instance of Physical Thing.		E18_Physical_Thing	E46_Section_Definition	P58i_defines_section	10000	0	0
P58i_defines_section	property	defines_section	defines section			E46_Section_Definition	E18_Physical_Thing	P58_has_section_definition	10000	0	0
P59_has_section	property	section	has section	This property links an area to the instance of E18 Physical Thing upon which it is found.\nIt is typically used when a named E46 Section Definition is not appropriate.\nE18 Physical Thing may be subdivided into arbitrary regions. \nP59 has section (is located on or within) is a shortcut. If the E53 Place is identified by a Section Definition, a more detailed representation can make use of the fully developed (i.e. indirect) path from E18 Physical Thing through P58 has section definition (defines section), E46 Section Definition, P87 is identified by (identifies) to E53 Place. A Place can only be located on or within one Physical Object.		E18_Physical_Thing	E53_Place	P59i_is_located_on_or_within	10000	0	0
P59i_is_located_on_or_within	property	located_on_or_within	is located on or within			E53_Place	E18_Physical_Thing	P59_has_section	10000	0	0
P62_depicts	property	depicts	depicts	This property identifies something that is depicted by an instance of E24 Physical Man-Made Thing. Depicting is meant in the sense that the surface of the E24 Physical Man-Made Thing shows, through its passive optical qualities or form, a representation of the entity depicted. It does not pertain to inscriptions or any other information encoding.\n\nThis property is a shortcut of the more fully developed path from E24 Physical Man-Made Thing through P65 shows visual item (is shown by), E36 Visual Item, P138 represents (has representation) to E1 CRM Entity. P62.1 mode of depiction allows the nature of the depiction to be refined.		E24_Physical_Man-Made_Thing	E1_CRM_Entity	P62i_is_depicted_by	10000	1	1
P62i_is_depicted_by	property	depicted_by	is depicted by			E1_CRM_Entity	E24_Physical_Man-Made_Thing	P62_depicts	10000	1	1
P65_shows_visual_item	property	shows	shows visual item	This property documents an E36 Visual Item shown by an instance of E24 Physical Man-Made Thing.\nThis property is similar to P62 depicts (is depicted by) in that it associates an item of E24 Physical Man-Made Thing with a visual representation. However, P65 shows visual item (is shown by) differs from the P62 depicts (is depicted by) property in that it makes no claims about what the E36 Visual Item is deemed to represent. E36 Visual Item identifies a recognisable image or visual symbol, regardless of what this image may or may not represent.\nFor example, all recent British coins bear a portrait of Queen Elizabeth II, a fact that is correctly documented using P62 depicts (is depicted by). Different portraits have been used at different periods, however. P65 shows visual item (is shown by) can be used to refer to a particular portrait.\nP65 shows visual item (is shown by) may also be used for Visual Items such as signs, marks and symbols, for example the 'Maltese Cross' or the 'copyright symbol’ that have no particular representational content. \nThis property is part of the fully developed path from E24 Physical Man-Made Thing through P65 shows visual item (is shown by), E36 Visual Item, P138 represents (has representation) to E1 CRM Entity which is shortcut by, P62 depicts (is depicted by).	P128_carries	E24_Physical_Man-Made_Thing	E36_Visual_Item	P65i_is_shown_by	10000	1	1
P65i_is_shown_by	property	shown_by	is shown by		P128i_is_carried_by	E36_Visual_Item	E24_Physical_Man-Made_Thing	P65_shows_visual_item	10000	1	1
P67_refers_to	property	refers_to	refers to	This property documents that an E89 Propositional Object makes a statement about an instance of E1 CRM Entity. P67 refers to (is referred to by) has the P67.1 has type link to an instance of E55 Type. This is intended to allow a more detailed description of the type of reference. This differs from P129 is about (is subject of), which describes the primary subject or subjects of the E89 Propositional Object.		E89_Propositional_Object	E1_CRM_Entity	P67i_is_referred_to_by	10000	1	1
P67i_is_referred_to_by	property	referred_to_by	is referred to by			E1_CRM_Entity	E89_Propositional_Object	P67_refers_to	10000	1	1
P68_foresees_use_of	property	foresees_use_of	foresees use of	This property identifies an E57 Material foreseeen to be used by an E29 Design or Procedure. \nE29 Designs and procedures commonly foresee the use of particular E57 Materials. The fabrication of adobe bricks, for example, requires straw, clay and water. This property enables this to be documented.\nThis property is not intended for the documentation of E57 Materials that were used on a particular occasion when an instance of E29 Design or Procedure was executed.	P67_refers_to	E29_Design_or_Procedure	E57_Material	P68i_use_foreseen_by	10000	0	0
P68i_use_foreseen_by	property	use_foreseen_by	use foreseen by		P67i_is_referred_to_by	E57_Material	E29_Design_or_Procedure	P68_foresees_use_of	10000	0	0
P69_is_associated_with	property	associated_with	is associated with	This property generalises relationships like whole-part, sequence, prerequisite or inspired by between instances of E29 Design or Procedure. Any instance of E29 Design or Procedure may be associated with other designs or procedures. The property is considered to be symmetrical unless otherwise indicated by P69.1 has type.\nThe P69.1 has type property of P69 has association with allows the nature of the association to be specified reading from domain to range; examples of types of association between instances of E29 Design or Procedure include: has part, follows, requires, etc.\nThe property can typically be used to model the decomposition of the description of a complete workflow into a series of separate procedures.		E29_Design_or_Procedure	E29_Design_or_Procedure		10000	0	0
P70_documents	property	documents	documents	This property describes the CRM Entities documented by instances of E31 Document.\nDocuments may describe any conceivable entity, hence the link to the highest-level entity in the CRM hierarchy. This property is intended for cases where a reference is regarded as being of a documentary character, in the scholarly or scientific sense.	P67_refers_to	E31_Document	E1_CRM_Entity	P70i_is_documented_in	10000	0	0
P70i_is_documented_in	property	documented_in	is documented in		P67i_is_referred_to_by	E1_CRM_Entity	E31_Document	P70_documents	10000	0	0
P71_lists	property	lists	lists	This property documents a source E32 Authority Document for an instance of an E1 CRM Entity.	P67_refers_to	E32_Authority_Document	E1_CRM_Entity	P71i_is_listed_in	10000	0	0
P71i_is_listed_in	property	listed_in	is listed in		P67i_is_referred_to_by	E1_CRM_Entity	E32_Authority_Document	P71_lists	10000	0	0
P72_has_language	property	language	has language	This property describes the E56 Language of an E33 Linguistic Object. \nLinguistic Objects are composed in one or more human Languages. This property allows these languages to be documented.		E33_Linguistic_Object	E56_Language	P72i_is_language_of	10000	1	1
P72i_is_language_of	property	language_of	is language of			E56_Language	E33_Linguistic_Object	P72_has_language	10000	1	1
P73_has_translation	property	translation	has translation	This property describes the source and target of instances of E33Linguistic Object involved in a translation.\nWhen a Linguistic Object is translated into a new language it becomes a new Linguistic Object, despite being conceptually similar to the source object.	P130_shows_features_of	E33_Linguistic_Object	E33_Linguistic_Object	P73i_is_translation_of	10000	1	1
P73i_is_translation_of	property	translation_of	is translation of		P130i_features_are_also_found_on	E33_Linguistic_Object	E33_Linguistic_Object	P73_has_translation	10000	1	1
P74_has_current_or_former_residence	property	current_or_former_residence	has current or former residence	This property describes the current or former E53 Place of residence of an E39 Actor. \nThe residence may be either the Place where the Actor resides, or a legally registered address of any kind.		E39_Actor	E53_Place	P74i_is_current_or_former_residence_of	10000	0	0
P74i_is_current_or_former_residence_of	property	current_or_former_residence_of	is current or former residence of			E53_Place	E39_Actor	P74_has_current_or_former_residence	10000	0	0
P75_possesses	property	possesses	possesses	This property identifies former or current instances of E30 Rights held by an E39 Actor.		E39_Actor	E30_Right	P75i_is_possessed_by	10000	1	1
P75i_is_possessed_by	property	possessed_by	is possessed by			E30_Right	E39_Actor	P75_possesses	10000	1	0
P76_has_contact_point	property	contact_point	has contact point	This property identifies an E51 Contact Point of any type that provides access to an E39 Actor by any communication method, such as e-mail or fax.		E39_Actor	E51_Contact_Point	P76i_provides_access_to	10000	0	0
P76i_provides_access_to	property	provides_access_to	provides access to			E51_Contact_Point	E39_Actor	P76_has_contact_point	10000	0	0
P78_is_identified_by	property	time_identified_by	is identified by	This property identifies an E52 Time-Span using an E49Time Appellation.	P1_is_identified_by	E52_Time-Span	E49_Time_Appellation	P78i_identifies	10000	0	0
P78i_identifies	property	identifies_time	identifies		P1i_identifies	E49_Time_Appellation	E52_Time-Span	P78_is_identified_by	10000	0	0
P79_beginning_is_qualified_by	property	beginning_is_qualified_by	beginning is qualified by	This property qualifies the beginning of an E52 Time-Span in some way. \nThe nature of the qualification may be certainty, precision, source etc.	P3_has_note	E52_Time-Span	rdfs:Literal		10000	0	0
P80_end_is_qualified_by	property	end_is_qualified_by	end is qualified by	This property qualifies the end of an E52 Time-Span in some way. \nThe nature of the qualification may be certainty, precision, source etc.	P3_has_note	E52_Time-Span	rdfs:Literal		10000	0	0
P81_ongoing_throughout	property	ongoing_throughout	ongoing throughout	This property describes the minimum period of time covered by an E52 Time-Span.\nSince Time-Spans may not have precisely known temporal extents, the CRM supports statements about the minimum and maximum temporal extents of Time-Spans. This property allows a Time-Span’s minimum temporal extent (i.e. its inner boundary) to be assigned an E61 Time Primitive value. Time Primitives are treated by the CRM as application or system specific date intervals, and are not further analysed.		E52_Time-Span	rdfs:Literal		10000	0	0
P82_at_some_time_within	property	at_some_time_within	at some time within	This property describes the maximum period of time within which an E52 Time-Span falls.\nSince Time-Spans may not have precisely known temporal extents, the CRM supports statements about the minimum and maximum temporal extents of Time-Spans. This property allows a Time-Span’s maximum temporal extent (i.e. its outer boundary) to be assigned an E61 Time Primitive value. Time Primitives are treated by the CRM as application or system specific date intervals, and are not further analysed.		E52_Time-Span	rdfs:Literal		10000	0	0
P83_had_at_least_duration	property	at_least_duration	had at least duration	This property describes the minimum length of time covered by an E52 Time-Span. \nIt allows an E52 Time-Span to be associated with an E54 Dimension representing it’s minimum duration (i.e. it’s inner boundary) independent from the actual beginning and end.		E52_Time-Span	E54_Dimension	P83i_was_minimum_duration_of	10000	0	0
P83i_was_minimum_duration_of	property	minimum_duration_of	was minimum duration of			E54_Dimension	E52_Time-Span	P83_had_at_least_duration	10000	0	0
P84_had_at_most_duration	property	at_most_duration	had at most duration	This property describes the maximum length of time covered by an E52 Time-Span. \nIt allows an E52 Time-Span to be associated with an E54 Dimension representing it’s maximum duration (i.e. it’s outer boundary) independent from the actual beginning and end.		E52_Time-Span	E54_Dimension	P84i_was_maximum_duration_of	10000	0	0
P84i_was_maximum_duration_of	property	maximum_duration_of	was maximum duration of			E54_Dimension	E52_Time-Span	P84_had_at_most_duration	10000	0	0
P86_falls_within	property	temporally_within	falls within	This property describes the inclusion relationship between two instances of E52 Time-Span.\nThis property supports the notion that a Time-Span’s temporal extent falls within the temporal extent of another Time-Span. It addresses temporal containment only, and no contextual link between the two instances of Time-Span is implied.		E52_Time-Span	E52_Time-Span	P86i_contains	10000	0	0
P86i_contains	property	temporally_contains	contains			E52_Time-Span	E52_Time-Span	P86_falls_within	103	0	0
P87_is_identified_by	property	place_identified_by	is identified by	This property identifies an E53 Place using an E44 Place Appellation. \nExamples of Place Appellations used to identify Places include instances of E48 Place Name, addresses, E47 Spatial Coordinates etc.	P1_is_identified_by	E53_Place	E44_Place_Appellation	P87i_identifies	10000	0	0
P87i_identifies	property	identifies_place	identifies		P1i_identifies	E44_Place_Appellation	E53_Place	P87_is_identified_by	10000	0	0
P89_falls_within	property	spatially_within	falls within	This property identifies an instance of E53 Place that falls wholly within the extent of another E53 Place.\nIt addresses spatial containment only, and does not imply any relationship between things or phenomena occupying these places.		E53_Place	E53_Place	P89i_contains	10000	1	1
P89i_contains	property	spatially_contains	contains			E53_Place	E53_Place	P89_falls_within	104	1	1
P90_has_value	property	has_value	has value	This property allows an E54 Dimension to be approximated by an E60 Number primitive.		E54_Dimension	rdfs:Literal		10000	0	0
P91_has_unit	property	unit	has unit	This property shows the type of unit an E54 Dimension was expressed in.		E54_Dimension	E58_Measurement_Unit	P91i_is_unit_of	10000	1	0
P91i_is_unit_of	property	unit_of	is unit of			E58_Measurement_Unit	E54_Dimension	P91_has_unit	10000	0	0
P92_brought_into_existence	property	brought_into_existence	brought into existence	This property allows an E63 Beginning of Existence event to be linked to the E77 Persistent Item brought into existence by it.\nIt allows a “start” to be attached to any Persistent Item being documented i.e. E70 Thing, E72 Legal Object, E39 Actor, E41 Appellation, E51 Contact Point and E55 Type	P12_occurred_in_the_presence_of	E63_Beginning_of_Existence	E77_Persistent_Item	P92i_was_brought_into_existence_by	10000	1	1
P92i_was_brought_into_existence_by	property	brought_into_existence_by	was brought into existence by		P12i_was_present_at	E77_Persistent_Item	E63_Beginning_of_Existence	P92_brought_into_existence	33	1	0
P93_took_out_of_existence	property	took_out_of_existence	took out of existence	This property allows an E64 End of Existence event to be linked to the E77 Persistent Item taken out of existence by it.\nIn the case of immaterial things, the E64 End of Existence is considered to take place with the destruction of the last physical carrier.\nThis allows an “end” to be attached to any Persistent Item being documented i.e. E70 Thing, E72 Legal Object, E39 Actor, E41 Appellation, E51 Contact Point and E55 Type. For many Persistent Items we know the maximum life-span and can infer, that they must have ended to exist. We assume in that case an End of Existence, which may be as unnoticeable as forgetting the secret knowledge by the last representative of some indigenous nation.	P12_occurred_in_the_presence_of	E64_End_of_Existence	E77_Persistent_Item	P93i_was_taken_out_of_existence_by	10000	1	1
P93i_was_taken_out_of_existence_by	property	taken_out_of_existence_by	was taken out of existence by		P12i_was_present_at	E77_Persistent_Item	E64_End_of_Existence	P93_took_out_of_existence	34	1	0
P94_has_created	property	created	has created	This property allows a conceptual E65 Creation to be linked to the E28 Conceptual Object created by it. \nIt represents the act of conceiving the intellectual content of the E28 Conceptual Object. It does not represent the act of creating the first physical carrier of the E28 Conceptual Object. As an example, this is the composition of a poem, not its commitment to paper.	P92_brought_into_existence	E65_Creation	E28_Conceptual_Object	P94i_was_created_by	10000	1	1
P94i_was_created_by	property	created_by	was created by		P92i_was_brought_into_existence_by	E28_Conceptual_Object	E65_Creation	P94_has_created	10000	1	0
P95_has_formed	property	formed	has formed	This property links the founding or E66 Formation for an E74 Group with the Group itself.	P92_brought_into_existence	E66_Formation	E74_Group	P95i_was_formed_by	10000	1	1
P95i_was_formed_by	property	formed_by	was formed by		P92i_was_brought_into_existence_by	E74_Group	E66_Formation	P95_has_formed	10000	1	0
